{
  "$schema": "http://json-schema.org/draft-07/schema",
  "title": "BulkScan",
  "type": "object",
  "properties": {
    "is_benefit_type_pip":  {"type": "string"},
    "is_benefit_type_esa":  {"type": "string"},
    "is_benefit_type_uc":  {"type": "string"},
    "contains_mrn": {"type": "string"},
    "mrn_date": {"type": "string"},
    "benefit_type_description": {"type": "string"},
    "person1_title": {"type": "string"},
    "person1_first_name": {"type": "string"},
    "person1_last_name": {"type": "string"},
    "person1_address_line1": {"type": "string"},
    "person1_address_line2": {"type": "string"},
    "person1_address_line3": {"type": "string"},
    "person1_address_line4": {"type": "string"},
    "person1_postcode": {"type": "string"},
    "person1_phone": {"type": "string"},
    "person1_mobile": {"type": "string"},
    "person1_email": {"type": "string"},
    "person1_want_sms_notifications": {"type": "string"},
    "person1_dob": {"type": "string"},
    "person1_nino": {"type": "string"},
    "person2_title": {"type": "string"},
    "person2_first_name": {"type": "string"},
    "person2_last_name": {"type": "string"},
    "person2_address_line1": {"type": "string"},
    "person2_address_line2": {"type": "string"},
    "person2_address_line3": {"type": "string"},
    "person2_address_line4": {"type": "string"},
    "person2_postcode": {"type": "string"},
    "person2_dob": {"type": "string"},
    "person2_nino": {"type": "string"},
    "representative_company": {"type": "string"},
    "representative_address_line1": {"type": "string"},
    "representative_address_line2": {"type": "string"},
    "representative_address_line3": {"type": "string"},
    "representative_address_line4": {"type": "string"},
    "representative_postcode": {"type": "string"},
    "representative_phone": {"type": "string"},
    "representative_email": {"type": "string"},
    "representative_mobile": {"type": "string"},
    "representative_want_sms_notifications": {"type": "string"},
    "representative_title": {"type": "string"},
    "representative_first_name": {"type": "string"},
    "representative_last_name": {"type": "string"},
    "appeal_grounds": {"type": "string"},
    "appeal_late_reason": {"type": "string"},
    "is_hearing_type_oral": {"type": "string"},
    "is_hearing_type_paper": {"type": "string"},
    "hearing_options_exclude_dates": {"type": "string"},
    "hearing_support_arrangements": {"type": "string"},
    "hearing_options_hearing_loop": {"type": "string"},
    "hearing_options_accessible_hearing_rooms": {"type": "string"},
    "hearing_options_sign_language_interpreter": {"type": "string"},
    "hearing_options_language_type": {"type": "string"},
    "hearing_options_dialect": {"type": "string"},
    "hearing_options_sign_language_type": {"type": "string"},
    "agree_less_hearing_notice": {"type": "string"},
    "signature_name": {"type": "string"},
    "signature_appeal_date": {"type": "string"},
    "office": {"type": "string"},
    "tell_tribunal_about_dates": {"type": "string"},
    "hearing_type_telephone": {"type": "string"},
    "hearing_telephone_number": {"type": "string"},
    "hearing_type_video": {"type": "string"},
    "hearing_video_email": {"type": "string"},
    "hearing_type_face_to_face": {"type": "string"},
    "appeal_grounds_2": {"type": "string"},
    "is_benefit_type_other": {"type": "string"},
    "benefit_type_other": {"type": "string"},
    "form_type": {"type": "string"}
  },
  "additionalProperties": false
}
