{
  "contains_mrn": "true",
  "mrn_date": "09/11/2018",
  "benefit_type_description": "Employment Support Allowance",
  "person1_title": "Mr",
  "person1_first_name": "John",
  "person1_last_name": "Smith",
  "person1_address_line1": "2 Drake Close",
  "person1_address_line2": "Hutton",
  "person1_address_line3": "Brentwood",
  "person1_address_line4": "Essex",
  "person1_postcode": "SE166RS",
  "person1_phone": "01895733303",
  "person1_mobile": "07832882849",
  "person1_dob": "11/11/1976",
  "person1_nino": "BB000000B",
  "person2_title": "Mrs",
  "person2_first_name": "Sarah",
  "person2_last_name": "Smith",
  "person2_address_line1": "10 Drake Close",
  "person2_address_line2": "Hutton",
  "person2_address_line3": "Brentwood",
  "person2_address_line4": "Essex",
  "person2_postcode": "SE166RS",
  "person2_dob": "09/12/1979",
  "person2_nino": "BB000000B",
  "representative_company": "ABC Advisory Services",
  "representative_address_line1": "63 Grovehill Road",
  "representative_address_line2": "The Square",
  "representative_address_line3": "Redhill",
  "representative_address_line4": "Surrey",
  "representative_postcode": "RH1 6RE",
  "representative_phone": "02072323231",
  "representative_title": "Mr",
  "representative_first_name": "Peter",
  "representative_last_name": "Hyland",
  "appeal_grounds": "see scanned SSCS1 form",
  "appeal_late_reason": "see scanned SSCS1 form",
  "is_hearing_type_oral": "true",
  "is_hearing_type_paper": "false",
  "hearing_options_exclude_dates": "I cannot attend on Mondays and I am on holiday in October.",
  "hearing_support_arrangements": "Wheelchair access" ,
  "hearing_options_hearing_loop": "Yes" ,
  "hearing_options_accessible_hearing_rooms": "No" ,
  "hearing_options_sign_language_interpreter": "No" ,
  "hearing_options_language_type": "Spanish" ,
  "hearing_options_dialect": "" ,
  "hearing_options_sign_language_type": "" ,
  "agree_less_hearing_notice": "true" ,
  "signature_name": "Sarah Smith" ,
  "signature_appeal_date": "01/04/2018"
}
